{
  "slug": "wireframe-first",
  "number": 15,
  "stage": "Discover",
  "title": "Wireframe first when fidelity doesn’t matter",
  "principle": "Asking for wireframes is much faster, and it keeps Claude focused on higher-level structure instead of visuals. Use this to try many different ideas quickly before committing to look-and-feel.",
  "procedure": [
    "When fidelity doesn’t matter, explicitly ask for wireframes only.",
    "Compare multiple structural directions quickly.",
    "Lock structure before high-fidelity visuals.",
    "Escalate fidelity only after hierarchy and flow feel right."
  ],
  "examplePrompts": [
    "Wireframe only—no visual styling. Gray boxes, labels, and hierarchy. Give me 5 structural alternatives for this flow so I can compare layout ideas quickly."
  ],
  "tips": [
    "Speed comes from skipping premature visual decisions.",
    "Structure-first prevents Claude from locking onto a favorite aesthetic early.",
    "Nate uses Claude Design daily for wireframing early ideas and generating many flow versions for feedback."
  ],
  "sourceUrls": [
    "https://claude.com/blog/how-the-product-designer-who-built-claude-design-uses-it-to-explore-ideas-before-building-them"
  ],
  "related": [
    "ten-options-then-remix",
    "thinking-before-prompt",
    "specify-the-look",
    "tc-ebc-elements"
  ],
  "workedExamples": [
    {
      "title": "Daily bread-and-butter wireframes",
      "body": "Nate uses Claude Design daily for wireframing early ideas and generating many flow versions for feedback—structure before visuals. Cite: Anthropic blog."
    },
    {
      "title": "Structure before skin",
      "body": "Nate: wireframe structure first so layout decisions aren’t entangled with look; then specify look / system from assets. Cite: Anthropic blog."
    }
  ],
  "antiPatterns": [
    "Jumping to polished visuals while structure is still mush.",
    "Letting early aesthetic defaults lock the layout.",
    "Asking for high-fidelity chrome before the information hierarchy is set."
  ],
  "checklist": [
    "Wireframe-only constraint stated.",
    "Multiple structures compared.",
    "Fidelity escalated on purpose."
  ],
  "promptWhy": [
    "Gray-box constraint keeps the model on hierarchy, not favorite aesthetics."
  ],
  "pairsWellWith": [
    "ten-options-then-remix",
    "thinking-before-prompt",
    "tc-ebc-elements",
    "specify-the-look"
  ]
}
